{
  "schema": "repository-experiment-registry/v1",
  "repository": "msazanov/vivante-vip9000-llm-lab",
  "generated_from": "remote branch inventory captured 2026-08-14; raw payloads remain on their authoritative refs",
  "experiments": [
    {
      "id": "E001",
      "title": "VIP9000 SDK and operator capability probe",
      "status": "planned",
      "claim_class": "planned",
      "branch": "main",
      "commit": "426d1467563da211f9621cc2692ec25cf065880d",
      "evidence": [{"kind": "branch_pointer", "path": "experiments/E001-vip9000-capability-probe/README.md", "ref": "main@426d1467563da211f9621cc2692ec25cf065880d", "note": "Original capability-probe plan."}],
      "metric": {},
      "notes": "Retained as the original capability question; target capability is now tracked by the canonical NPU map.",
      "is_current_best": false,
      "end_to_end": false,
      "optimization_claim": false
    },
    {
      "id": "E002",
      "title": "Packed ternary kernel study",
      "status": "planned",
      "claim_class": "planned",
      "branch": "main",
      "commit": "426d1467563da211f9621cc2692ec25cf065880d",
      "evidence": [{"kind": "branch_pointer", "path": "experiments/E002-packed-ternary-kernel/README.md", "ref": "main@426d1467563da211f9621cc2692ec25cf065880d", "note": "Original packed-ternary study plan."}],
      "metric": {},
      "notes": "Superseded as a plan by the Q1-specific evidence sequence; no result is promoted from this row.",
      "is_current_best": false,
      "end_to_end": false,
      "optimization_claim": false
    },
    {
      "id": "E003",
      "title": "Packed Q1 carrier and EVIS Q1 x Q8",
      "status": "accepted",
      "claim_class": "operator",
      "branch": "codex/profiling-foundation",
      "commit": "c071476773ad0f7fc499b6a39270a98bc1e25878",
      "evidence": [{"kind": "branch_pointer", "path": "experiments/E003-q1-packed-carrier/README.md", "ref": "codex/profiling-foundation@c071476773ad0f7fc499b6a39270a98bc1e25878", "note": "Target EVIS capability and golden evidence; not a full-model claim."}],
      "metric": {"exact_quality": true},
      "notes": "Accepted as a target-verified packed-Q1 operator proof. Large-layer scaling is handled by later rows.",
      "is_current_best": false,
      "end_to_end": false,
      "optimization_claim": false
    },
    {
      "id": "E004",
      "title": "CPU Q1 operator baseline",
      "status": "accepted",
      "claim_class": "operator",
      "branch": "codex/profiling-foundation",
      "commit": "c071476773ad0f7fc499b6a39270a98bc1e25878",
      "evidence": [{"kind": "branch_pointer", "path": "experiments/E004-q1-cpu-operator-baseline/", "ref": "codex/profiling-foundation@c071476773ad0f7fc499b6a39270a98bc1e25878", "note": "CPU golden/operator reference."}],
      "metric": {"exact_quality": true},
      "notes": "Reference implementation for Q1 operator correctness and comparison.",
      "is_current_best": false,
      "end_to_end": false,
      "optimization_claim": false
    },
    {
      "id": "E005",
      "title": "A733 DDR PLL guarded A/B",
      "status": "failed",
      "claim_class": "hardware",
      "branch": "codex/profiling-foundation",
      "commit": "c071476773ad0f7fc499b6a39270a98bc1e25878",
      "evidence": [{"kind": "branch_pointer", "path": "experiments/E005-a733-ddr-pll-ab/README.md", "ref": "codex/profiling-foundation@c071476773ad0f7fc499b6a39270a98bc1e25878", "note": "Guarded PLL attempt retained with reset boundary."}],
      "metric": {},
      "notes": "The run did not establish a supported operating point or a performance result; do not infer safe overclock behavior.",
      "is_current_best": false,
      "end_to_end": false,
      "optimization_claim": false
    },
    {
      "id": "E006",
      "title": "PowerVR Vulkan Q1 shared-memory gate",
      "status": "failed",
      "claim_class": "operator",
      "branch": "codex/profiling-foundation",
      "commit": "c071476773ad0f7fc499b6a39270a98bc1e25878",
      "evidence": [{"kind": "branch_pointer", "path": "experiments/E006-powervr-vulkan-q1/README.md", "ref": "codex/profiling-foundation@c071476773ad0f7fc499b6a39270a98bc1e25878", "note": "Driver failure retained as negative evidence."}],
      "metric": {},
      "notes": "The driver path did not complete the intended Q1 pipeline gate.",
      "is_current_best": false,
      "end_to_end": false,
      "optimization_claim": false
    },
    {
      "id": "E007",
      "title": "PowerVR OpenCL packed-Q1 GEMV",
      "status": "rejected",
      "claim_class": "operator",
      "branch": "codex/profiling-foundation",
      "commit": "c071476773ad0f7fc499b6a39270a98bc1e25878",
      "evidence": [{"kind": "branch_pointer", "path": "experiments/E007-powervr-opencl-q1/README.md", "ref": "codex/profiling-foundation@c071476773ad0f7fc499b6a39270a98bc1e25878", "note": "Retained baseline and compatibility evidence."}],
      "metric": {},
      "notes": "Not promoted to the VIP9000 backend path.",
      "is_current_best": false,
      "end_to_end": false,
      "optimization_claim": false
    },
    {
      "id": "E008",
      "title": "A733 Q1 DOTPROD 4x4 versus 4x8",
      "status": "rejected",
      "claim_class": "operator",
      "branch": "codex/profiling-foundation",
      "commit": "c071476773ad0f7fc499b6a39270a98bc1e25878",
      "evidence": [{"kind": "branch_pointer", "path": "experiments/E008-a733-q1-4x8/README.md", "ref": "codex/profiling-foundation@c071476773ad0f7fc499b6a39270a98bc1e25878", "note": "Layout candidate evidence."}],
      "metric": {},
      "notes": "The candidate is retained but is not a promoted A733 Q1 path.",
      "is_current_best": false,
      "end_to_end": false,
      "optimization_claim": false
    },
    {
      "id": "E009",
      "title": "A733 Q1 packed-weight prefetch",
      "status": "rejected",
      "claim_class": "operator",
      "branch": "codex/profiling-foundation",
      "commit": "c071476773ad0f7fc499b6a39270a98bc1e25878",
      "evidence": [{"kind": "branch_pointer", "path": "experiments/E009-a733-q1-prefetch/README.md", "ref": "codex/profiling-foundation@c071476773ad0f7fc499b6a39270a98bc1e25878", "note": "Prefetch candidate evidence."}],
      "metric": {},
      "notes": "Retained as a rejected CPU candidate; later cluster-specific work has its own row.",
      "is_current_best": false,
      "end_to_end": false,
      "optimization_claim": false
    },
    {
      "id": "E009-fused",
      "title": "Packed Q1 to native fully connected",
      "status": "planned",
      "claim_class": "planned",
      "branch": "codex/profiling-foundation",
      "commit": "c071476773ad0f7fc499b6a39270a98bc1e25878",
      "evidence": [{"kind": "branch_pointer", "path": "experiments/E009-fused-q1-native-fc/README.md", "ref": "codex/profiling-foundation@c071476773ad0f7fc499b6a39270a98bc1e25878", "note": "Fused-NBG direction retained for follow-up."}],
      "metric": {},
      "notes": "The fused EVIS-unpack to native-NN gate remains a planned next step.",
      "is_current_best": false,
      "end_to_end": false,
      "optimization_claim": false
    },
    {
      "id": "E019",
      "title": "Direct EVIS INT16 GEMM",
      "status": "accepted",
      "claim_class": "operator",
      "branch": "codex/profiling-foundation",
      "commit": "c071476773ad0f7fc499b6a39270a98bc1e25878",
      "evidence": [{"kind": "branch_pointer", "path": "experiments/E019-q1-i16-evis-gemm/README.md", "ref": "codex/profiling-foundation@c071476773ad0f7fc499b6a39270a98bc1e25878", "note": "Exact target golden path, retained as a capability proof."}],
      "metric": {"exact_quality": true},
      "notes": "The generic INT16 EVIS path is correct but too slow for Bonsai production decode.",
      "is_current_best": false,
      "end_to_end": false,
      "optimization_claim": false
    },
    {
      "id": "E020",
      "title": "Multiple custom EVIS kernels in one NBG",
      "status": "accepted",
      "claim_class": "operator",
      "branch": "codex/profiling-foundation",
      "commit": "c071476773ad0f7fc499b6a39270a98bc1e25878",
      "evidence": [{"kind": "branch_pointer", "path": "experiments/E020-two-custom-kernel/README.md", "ref": "codex/profiling-foundation@c071476773ad0f7fc499b6a39270a98bc1e25878", "note": "Multi-kernel NBG execution proof."}],
      "metric": {"exact_quality": true},
      "notes": "Accepted as a graph-construction and execution capability, not as a full-model speed result.",
      "is_current_best": false,
      "end_to_end": false,
      "optimization_claim": false
    },
    {
      "id": "E020a",
      "title": "Q1 unpack to native fully connected",
      "status": "unqualified",
      "claim_class": "operator",
      "branch": "codex/e023-ggml-q1-seam",
      "commit": "7a79466f7f65a67d64c0624eabf60d63652960b8",
      "evidence": [{"kind": "branch_pointer", "path": "experiments/E020-q1-unpack-native-fc/README.md", "ref": "codex/e023-ggml-q1-seam@7a79466f7f65a67d64c0624eabf60d63652960b8", "note": "Native-FC candidate evidence."}],
      "metric": {},
      "notes": "Retained without a promoted full-model or native-NN claim.",
      "is_current_best": false,
      "end_to_end": false,
      "optimization_claim": false
    },
    {
      "id": "E021",
      "title": "Q1 unpack to native matrix multiply",
      "status": "unqualified",
      "claim_class": "operator",
      "branch": "codex/e023-ggml-q1-seam",
      "commit": "7a79466f7f65a67d64c0624eabf60d63652960b8",
      "evidence": [{"kind": "branch_pointer", "path": "experiments/E021-q1-unpack-native-matmul/README.md", "ref": "codex/e023-ggml-q1-seam@7a79466f7f65a67d64c0624eabf60d63652960b8", "note": "Matrix-multiply candidate evidence."}],
      "metric": {},
      "notes": "Shape/layout proof remains bounded and does not qualify a model path.",
      "is_current_best": false,
      "end_to_end": false,
      "optimization_claim": false
    },
    {
      "id": "E022",